{
  "schema_version": "1.0",
  "iteration": 136,
  "slot": 3,
  "task_id": "#IMP-114",
  "status": "completed",
  "duration_seconds": 45,

  "files_changed": [
    {
      "path": "src/app/(app)/w/[workspaceId]/ai-analysis/ai-analysis-view.tsx",
      "action": "modified",
      "lines_added": 1,
      "lines_removed": 0
    }
  ],

  "verification": {
    "typecheck": { "status": "pass", "errors": 0, "output": "" },
    "lint": { "status": "skipped", "errors": 0, "output": "" },
    "build": { "status": "not_applicable", "output": "" },
    "unit_tests": { "status": "not_applicable", "passed": 0, "failed": 0, "output": "" }
  },

  "dependencies_added": [],
  "staged_files": [
    "src/app/(app)/w/[workspaceId]/ai-analysis/ai-analysis-view.tsx"
  ],
  "ownership_violations": [],
  "notes": "Added title attribute to the Regenerate button: title={!hasSteps ? 'Add steps to the canvas before running AI analysis' : undefined}. Native browser tooltip via title attribute. Button remains disabled with cursor-not-allowed styling when !hasSteps.",

  "failure_details": null
}
