{
  "schema_version": "1.0",
  "iteration": 104,
  "slot": 1,
  "task_id": "#FEAT-033",
  "status": "completed",
  "duration_seconds": 480,

  "files_changed": [
    {
      "path": "src/app/(app)/w/[workspaceId]/perspectives/compare/page.tsx",
      "action": "created",
      "lines_added": 53,
      "lines_removed": 0
    },
    {
      "path": "src/app/(app)/w/[workspaceId]/perspectives/compare/export-pdf.ts",
      "action": "created",
      "lines_added": 343,
      "lines_removed": 0
    },
    {
      "path": "src/app/(app)/w/[workspaceId]/perspectives/compare/perspectives-compare-view.tsx",
      "action": "created",
      "lines_added": 491,
      "lines_removed": 0
    },
    {
      "path": "src/app/(app)/w/[workspaceId]/workspace-shell.tsx",
      "action": "modified",
      "lines_added": 1,
      "lines_removed": 1
    },
    {
      "path": "src/components/layout/sidebar.tsx",
      "action": "modified",
      "lines_added": 3,
      "lines_removed": 1
    }
  ],

  "verification": {
    "typecheck": { "status": "pass", "errors": 0, "output": "" },
    "lint": { "status": "pass", "errors": 0, "output": "1 pre-existing warning in flow-canvas.tsx (unused import) — known acceptable per LEARNINGS.md" },
    "build": { "status": "not_applicable", "output": "Build gate handled post-merge by pipeline" },
    "unit_tests": { "status": "not_applicable", "passed": 0, "failed": 0, "output": "No unit tests for UI pages" }
  },

  "dependencies_added": [],

  "staged_files": [
    "src/app/(app)/w/[workspaceId]/perspectives/compare/page.tsx",
    "src/app/(app)/w/[workspaceId]/perspectives/compare/export-pdf.ts",
    "src/app/(app)/w/[workspaceId]/perspectives/compare/perspectives-compare-view.tsx",
    "src/app/(app)/w/[workspaceId]/workspace-shell.tsx",
    "src/components/layout/sidebar.tsx"
  ],

  "ownership_violations": [],

  "notes": "Implemented perspective comparison view at /w/[workspaceId]/perspectives/compare. Server page fetches all perspectives + element lookup map (steps/sections/stages/touchpoints with tab_id). Client view has two perspective dropdowns, fetches annotations client-side via fetchAnnotations(), builds comparison table with divergence highlighting (DIVERGENCE_THRESHOLD=2). Summary stats panel shows annotation counts, avg ratings, divergence count, top 3 most divergent elements as navigation links. Element names link to /w/{workspaceId}/{tabId}. PDF export uses jsPDF (dynamically imported from local export-pdf.ts), writes title page + per-perspective stats + comparison table with amber row tinting for divergent rows. Sidebar updated with Eye icon and Perspectives nav item positioned after Compare. workspace-shell.tsx exclusion list updated with 'perspectives'. Workflows active check updated to also exclude /perspectives path. Caught and fixed JSX text em dash issue (literal \\u2014 in text nodes rendered as literal characters) — replaced with JSX expression {em-dash}.",

  "failure_details": null
}
