{
  "schema_version": "1.0",
  "iteration": 93,
  "slot": 2,
  "task_id": "#BUG-018",
  "status": "completed",
  "duration_seconds": 180,

  "files_changed": [
    { "path": "src/app/api/v1/connections/route.ts", "action": "modified", "lines_added": 1, "lines_removed": 1 },
    { "path": "src/app/api/v1/connections/[id]/route.ts", "action": "modified", "lines_added": 1, "lines_removed": 1 },
    { "path": "src/app/api/v1/sections/route.ts", "action": "modified", "lines_added": 1, "lines_removed": 1 },
    { "path": "src/app/api/v1/sections/[id]/route.ts", "action": "modified", "lines_added": 2, "lines_removed": 2 },
    { "path": "src/app/api/v1/shares/route.ts", "action": "modified", "lines_added": 1, "lines_removed": 1 },
    { "path": "src/app/api/v1/shares/[id]/route.ts", "action": "modified", "lines_added": 2, "lines_removed": 2 },
    { "path": "src/app/api/v1/stages/route.ts", "action": "modified", "lines_added": 1, "lines_removed": 1 },
    { "path": "src/app/api/v1/stages/[id]/route.ts", "action": "modified", "lines_added": 2, "lines_removed": 2 },
    { "path": "src/app/api/v1/steps/route.ts", "action": "modified", "lines_added": 1, "lines_removed": 1 },
    { "path": "src/app/api/v1/steps/[id]/route.ts", "action": "modified", "lines_added": 2, "lines_removed": 2 },
    { "path": "src/app/api/v1/tabs/route.ts", "action": "modified", "lines_added": 1, "lines_removed": 1 },
    { "path": "src/app/api/v1/tabs/[id]/route.ts", "action": "modified", "lines_added": 2, "lines_removed": 2 },
    { "path": "src/app/api/v1/touchpoints/route.ts", "action": "modified", "lines_added": 1, "lines_removed": 1 },
    { "path": "src/app/api/v1/touchpoints/[id]/route.ts", "action": "modified", "lines_added": 2, "lines_removed": 2 },
    { "path": "src/app/api/v1/touchpoint-connections/route.ts", "action": "modified", "lines_added": 1, "lines_removed": 1 },
    { "path": "src/app/api/v1/touchpoint-connections/[id]/route.ts", "action": "modified", "lines_added": 1, "lines_removed": 1 },
    { "path": "src/app/api/v1/workspaces/route.ts", "action": "modified", "lines_added": 1, "lines_removed": 1 },
    { "path": "src/app/api/v1/workspaces/[id]/route.ts", "action": "modified", "lines_added": 2, "lines_removed": 2 }
  ],

  "verification": {
    "typecheck": { "status": "pass", "errors": 0, "output": "npx tsc --noEmit — no output (clean)" },
    "lint": { "status": "pass", "errors": 0, "output": "1 pre-existing warning in flow-canvas.tsx (unused 'addEdge' import — documented in LEARNINGS.md)" },
    "build": { "status": "not_applicable", "output": "" },
    "unit_tests": { "status": "not_applicable", "passed": 0, "failed": 0, "output": "" }
  },

  "dependencies_added": [],
  "staged_files": [
    "src/app/api/v1/connections/route.ts",
    "src/app/api/v1/connections/[id]/route.ts",
    "src/app/api/v1/sections/route.ts",
    "src/app/api/v1/sections/[id]/route.ts",
    "src/app/api/v1/shares/route.ts",
    "src/app/api/v1/shares/[id]/route.ts",
    "src/app/api/v1/stages/route.ts",
    "src/app/api/v1/stages/[id]/route.ts",
    "src/app/api/v1/steps/route.ts",
    "src/app/api/v1/steps/[id]/route.ts",
    "src/app/api/v1/tabs/route.ts",
    "src/app/api/v1/tabs/[id]/route.ts",
    "src/app/api/v1/touchpoints/route.ts",
    "src/app/api/v1/touchpoints/[id]/route.ts",
    "src/app/api/v1/touchpoint-connections/route.ts",
    "src/app/api/v1/touchpoint-connections/[id]/route.ts",
    "src/app/api/v1/workspaces/route.ts",
    "src/app/api/v1/workspaces/[id]/route.ts"
  ],
  "ownership_violations": [],
  "notes": "Mechanical fix: added 'void' prefix to all bare logActivity() calls in owned API route files. 25 total call sites across 18 files fixed. All 'await logActivity(' calls in non-owned files (annotations, roles, people, step-roles, runbook-steps) left untouched. Zero remaining bare calls in owned files confirmed via grep.",

  "failure_details": null
}
