{
  "schema_version": "1.0",
  "iteration": 104,
  "slot": 3,
  "task_id": "#IMP-039",
  "status": "completed",
  "duration_seconds": 45,

  "files_changed": [
    {
      "path": "src/app/(app)/w/[workspaceId]/activity/activity-view.tsx",
      "action": "modified",
      "lines_added": 1,
      "lines_removed": 1
    }
  ],

  "verification": {
    "typecheck": { "status": "pass", "errors": 0, "output": "" },
    "lint": { "status": "pass", "errors": 0, "output": "1 pre-existing warning in flow-canvas.tsx (unused addEdge) — unrelated to this change" },
    "build": { "status": "not_applicable", "output": "" },
    "unit_tests": { "status": "not_applicable", "passed": 0, "failed": 0, "output": "" }
  },

  "dependencies_added": [],
  "staged_files": [
    "src/app/(app)/w/[workspaceId]/activity/activity-view.tsx"
  ],
  "ownership_violations": [],
  "notes": "Single string replacement at line 176: `?? \"Unknown\"` → `?? \"[Deleted User]\"`",

  "failure_details": null
}
