{
  "schema_version": "1.0",
  "iteration": 96,
  "slot": 2,
  "task_id": "#FEAT-051",
  "status": "completed",
  "duration_seconds": 720,

  "files_changed": [
    {
      "path": "src/types/canvas.ts",
      "action": "modified",
      "lines_added": 5,
      "lines_removed": 0
    },
    {
      "path": "src/components/canvas/step-node.tsx",
      "action": "modified",
      "lines_added": 5,
      "lines_removed": 1
    },
    {
      "path": "src/components/canvas/coloring-panel.tsx",
      "action": "created",
      "lines_added": 347,
      "lines_removed": 0
    },
    {
      "path": "src/app/(app)/w/[workspaceId]/[tabId]/canvas-view.tsx",
      "action": "modified",
      "lines_added": 83,
      "lines_removed": 8
    },
    {
      "path": "src/app/api/v1/coloring-rules/route.ts",
      "action": "modified",
      "lines_added": 5,
      "lines_removed": 0
    },
    {
      "path": "src/app/api/v1/coloring-rules/[id]/route.ts",
      "action": "modified",
      "lines_added": 17,
      "lines_removed": 2
    }
  ],

  "verification": {
    "typecheck": { "status": "pass", "errors": 0, "output": "npx tsc --noEmit — no output (clean)" },
    "lint": { "status": "pass", "errors": 0, "output": "1 pre-existing warning in flow-canvas.tsx (unused import — documented in LEARNINGS.md as acceptable). No new errors or warnings." },
    "build": { "status": "pass", "output": "Compiled successfully in 5.5s. All 31 static pages generated." },
    "unit_tests": { "status": "not_applicable", "passed": 0, "failed": 0, "output": "No unit tests for UI components in this project." }
  },

  "dependencies_added": [],
  "staged_files": [
    "src/types/canvas.ts",
    "src/components/canvas/step-node.tsx",
    "src/components/canvas/coloring-panel.tsx",
    "src/app/(app)/w/[workspaceId]/[tabId]/canvas-view.tsx",
    "src/app/api/v1/coloring-rules/route.ts",
    "src/app/api/v1/coloring-rules/[id]/route.ts"
  ],
  "ownership_violations": [],
  "notes": "Coloring tint passed via ColoringTintContext (Map<stepId, hex>) following the existing CommentCountsContext/TaskCountsContext pattern — avoids prop-drilling through read-only flow-canvas.tsx. Paintbrush button rendered as absolute overlay at top-right of canvas (avoids z-index conflict with react-flow Panel toolbar at top-left). 15% opacity in hex = 0x26 appended to rule color (#RRGGBBAA). HeatMapMode takes precedence in step-node.tsx (unchanged logic path). CriteriaType import removed from [id]/route.ts since ValidCriteriaType is derived from the const array.",
  "failure_details": null
}
